{
  "schema_version": "1.1",
  "tool": {
    "name": "agent-health",
    "version": "2.0.0",
    "script": "scripts/agents/health_report.py"
  },
  "generated_at": "2026-01-15T05:17:17.351673+00:00",
  "profile": "dev",
  "status": "warning",
  "summary": {
    "passed": 3,
    "failed": 0,
    "warning": 1,
    "skipped": 1
  },
  "checks": [
    {
      "name": "lint",
      "status": "passed",
      "summary": "No linting issues",
      "duration_seconds": 0.2,
      "details": {
        "command": "uv run ruff check ."
      }
    },
    {
      "name": "types",
      "status": "passed",
      "summary": "No type errors",
      "duration_seconds": 20.1,
      "details": {
        "command": "uv run mypy src/gpt_trader"
      }
    },
    {
      "name": "tests",
      "status": "skipped",
      "summary": "Skipped (no --pytest-args)",
      "duration_seconds": 0.0,
      "details": {}
    },
    {
      "name": "preflight",
      "status": "warning",
      "summary": "9 passed, 2 warnings, 0 errors",
      "duration_seconds": 4.2,
      "details": {
        "profile": "dev"
      }
    },
    {
      "name": "config_validation",
      "status": "passed",
      "summary": "No config validation errors",
      "duration_seconds": 0.1,
      "details": {
        "profile": "dev"
      }
    }
  ],
  "ci_inputs": [
    {
      "path": "var/results/pytest_report.json",
      "format": "pytest-json",
      "status": "ok",
      "summary": {
        "passed": 120,
        "failed": 2,
        "errors": 0,
        "skipped": 4,
        "total": 126,
        "duration_seconds": 12.4
      }
    }
  ],
  "test_summary": {
    "passed": 120,
    "failed": 2,
    "errors": 0,
    "skipped": 4,
    "total": 126,
    "duration_seconds": 12.4,
    "sources": [
      {
        "source": "ci-input",
        "path": "var/results/pytest_report.json",
        "format": "pytest-json",
        "summary": {
          "passed": 120,
          "failed": 2,
          "errors": 0,
          "skipped": 4,
          "total": 126,
          "duration_seconds": 12.4
        }
      }
    ]
  },
  "hints": [
    "Run `uv run python scripts/production_preflight.py --profile dev --verbose`."
  ]
}
